{
  "analysis_plan_sha256": null,
  "api_version": null,
  "case_order_seed": 42,
  "cases_completed": 10,
  "cases_total": 10,
  "condition": "lovspor",
  "dataset_checksum": "1489c5fdd84487d566a67f9dc6c343e31a8b80fb214c03e6eeed83a8ca23f22c",
  "errors_total": 0,
  "evaluator_version": null,
  "finished_at": "2026-08-10T17:46:39Z",
  "llhb_version": "1.0",
  "lovspor_commit": "1b06ba668fc5e735b7390576f31bb678faf49f2f",
  "lovverk_commit": "6ec7059d53d25ddae99d8a64bf5157a90c4c166c",
  "max_turns": null,
  "model_id": "claude-opus-5",
  "notes": "pilot on discarded candidates from candidates.jsonl; NOT the frozen dataset; cli=2.1.226 (Claude Code); the CLI exposes no temperature or max-turn control, so both are recorded as unset; semantic_search is served but non-functional (no OPENAI_API_KEY): 15 of 16 tools usable, embedding-based retrieval untested in this run",
  "provider": "anthropic",
  "run_id": "llhb-v1-run-20260810-treat3",
  "runner_commit": "1b06ba668fc5e735b7390576f31bb678faf49f2f",
  "sampling": {
    "temperature": null
  },
  "started_at": "2026-08-10T17:41:37Z",
  "system_prompt_path": "benchmarks/llhb/runner/system-prompt-v1.txt",
  "system_prompt_sha256": "1e984ac1bdb481be7dda5a20b84c1b84edf608e9b4739b346aef59017ef890ec",
  "tool_config": {
    "backend": "local stdio `lovspor mcp` on lovverk 6ec7059d53d25ddae99d8a64bf5157a90c4c166c",
    "tool_schema_sha256": "74bf6f11d8695c0fe8b4d71d1910a6228f77cec0618900af581782c86460d955",
    "tools": [
      "mcp__lovverk__corpus_status",
      "mcp__lovverk__diff_law_versions",
      "mcp__lovverk__get_eu_basis",
      "mcp__lovverk__get_law",
      "mcp__lovverk__get_law_at",
      "mcp__lovverk__get_law_history",
      "mcp__lovverk__get_section",
      "mcp__lovverk__list_law_versions",
      "mcp__lovverk__list_recent_changes",
      "mcp__lovverk__list_sections",
      "mcp__lovverk__search_body",
      "mcp__lovverk__search_eu_implementations",
      "mcp__lovverk__search_laws",
      "mcp__lovverk__semantic_search",
      "mcp__lovverk__validate_citation",
      "mcp__lovverk__verify_quote"
    ],
    "transport": "native-mcp"
  }
}
