{
  "analysis_plan_sha256": "f04018ef9db1c9ef3632438d7f3131b8e176259856d3fc5070e6427c910032fd",
  "api_version": null,
  "case_order_seed": 42,
  "cases_completed": 2,
  "cases_total": 2,
  "condition": "control",
  "dataset_checksum": "9b8ead91ee4a0a642b4c48cbe56605a7dbad51239de388c622817ca4ba18f2f7",
  "errors_total": 0,
  "evaluator_version": null,
  "finished_at": "2026-08-25T11:19:58Z",
  "llhb_version": "1.0",
  "lovspor_commit": "52d01041339cbe2c325ca62c319b3a6fd8a06ae5",
  "lovverk_commit": "6ec7059d53d25ddae99d8a64bf5157a90c4c166c",
  "max_turns": null,
  "model_id": "NorMistral-11b-thinking:latest",
  "notes": "pilot on discarded candidates from candidates.jsonl; NOT the frozen dataset; driver=openai-chat base_url=https://chat.llm.sigma2.no/api; temperature recorded in sampling; single completion per case, so max-turn does not apply",
  "provider": "norallm",
  "run_id": "llhb-v1-run-20260825-nmpilot",
  "runner_commit": "52d01041339cbe2c325ca62c319b3a6fd8a06ae5",
  "sampling": {
    "temperature": 0.0
  },
  "started_at": "2026-08-25T11:19:33Z",
  "system_prompt_path": "benchmarks/llhb/runner/system-prompt-v1.txt",
  "system_prompt_sha256": "1e984ac1bdb481be7dda5a20b84c1b84edf608e9b4739b346aef59017ef890ec",
  "tool_config": null
}
